{
  "schema_version": "1.0",
  "id": "20000000-0000-4000-8000-000000000001",
  "tenant_id": "10000000-0000-4000-8000-000000000001",
  "provider": "whatsapp",
  "external_connection_id": "waba-connection-synthetic-001",
  "status": "active",
  "adapter_metadata": {
    "display_name": "Synthetic Demo Line",
    "verified": true
  },
  "created_at": "2026-07-12T08:00:00.000Z",
  "updated_at": "2026-07-12T08:30:00.000Z"
}
